{
  "$schema": "https://json-schema.org/draft/2020-12/schema",
  "$id": "https://raw.githubusercontent.com/DutchJaFO/Quotinator/main/schemas/changelog.schema.json",
  "title": "Quotinator Changelog (per-language file)",
  "description": "Schema for a single per-language changelog file (changelog.en.json, changelog.nl.json, etc.). The generation script (scripts/changelog.csx) produces CHANGELOG.md and addon/CHANGELOG.md from changelog.en.json. Never edit the generated markdown files directly.",
  "type": "object",
  "required": ["language", "sourceLanguage", "releases"],
  "additionalProperties": false,
  "properties": {
    "language": {
      "type": "string",
      "description": "ISO 639-1 code of the language used in this file (e.g. 'en', 'nl', 'de'). Must match the file's content — used to key the file in the service and acts as confirmation that the filename and content agree."
    },
    "sourceLanguage": {
      "type": "string",
      "description": "ISO 639-1 code of the fallback language file. When language == sourceLanguage there is no further fallback (this file is authoritative). The service uses this to walk the fallback chain when the requested language file is absent.",
      "default": "en"
    },
    "machineTranslated": {
      "type": "boolean",
      "description": "True when the content of this file was machine-generated rather than manually curated. The Blazor UI shows a disclaimer when this is true. Omit or set false for hand-written or source-language files.",
      "default": false
    },
    "sectionHeaders": {
      "$ref": "#/$defs/sectionHeadersEntry",
      "description": "Localised display names for the five changelog sections in the language of this file. Optional — when absent the generator uses built-in English strings."
    },
    "unreleased": {
      "description": "Changes not yet in a release, following the Keep a Changelog [Unreleased] convention. Rendered as ## [Unreleased] at the top of keepachangelog format output. Omitted from ha-addon format — HA Store shows only released versions.",
      "unevaluatedProperties": false,
      "allOf": [{ "$ref": "#/$defs/changelogEntry" }]
    },
    "releases": {
      "type": "array",
      "description": "Ordered list of releases, newest first.",
      "items": { "$ref": "#/$defs/release" }
    }
  },
  "$defs": {
    "sectionHeadersEntry": {
      "type": "object",
      "description": "Display names for all five sections in one language. All keys are optional.",
      "additionalProperties": false,
      "properties": {
        "highlights": { "type": "string", "minLength": 1 },
        "added":      { "type": "string", "minLength": 1 },
        "changed":    { "type": "string", "minLength": 1 },
        "fixed":      { "type": "string", "minLength": 1 },
        "removed":    { "type": "string", "minLength": 1 }
      }
    },
    "changelogEntry": {
      "type": "object",
      "description": "Base content shared by unreleased and release entries. Deliberately carries no 'unevaluatedProperties' of its own — that restriction lives on each composing site ('unreleased' and 'release' $defs) instead, alongside their own extra properties (version/date/quote for 'release'). A base schema referenced via $ref cannot see a referencing schema's sibling 'properties' annotations, so declaring 'unevaluatedProperties: false' here as well would make it independently reject every valid 'release'/'unreleased' instance — this was a real, previously-undetected bug (no test ever ran full schema validation against real data until #178's schema tests surfaced it).",
      "properties": {
        "issues": {
          "type": "array",
          "description": "GitHub issue numbers this work addresses. Must be set manually — issue numbers are ambiguous in prose and cannot be auto-detected.",
          "items": { "type": "integer", "minimum": 1 }
        },
        "cves": {
          "type": "array",
          "description": "CVE IDs this work addresses (e.g. 'CVE-2025-6965').",
          "items": { "type": "string", "pattern": "^CVE-\\d{4}-\\d{4,}$" }
        },
        "highlights": {
          "type": "array",
          "description": "User-facing plain-language summary. Each item is one sentence. No CVE IDs, API paths, class names, or technical terms. Omit or leave empty for internal-only releases.",
          "items": { "type": "string", "minLength": 1 }
        },
        "audienceHighlights": {
          "type": "object",
          "description": "Audience-specific highlight overrides keyed by audience identifier (e.g. 'ha-addon'). When a key is present and non-empty, the generator uses those items for that audience instead of the standard highlights. When present but empty ([]), the generator emits 'No user-facing changes.' When the key is absent, the standard highlights are used as fallback.",
          "additionalProperties": {
            "type": "array",
            "items": { "type": "string", "minLength": 1 }
          }
        },
        "added": {
          "type": "array",
          "description": "Technical description of new features added.",
          "items": { "type": "string", "minLength": 1 }
        },
        "changed": {
          "type": "array",
          "description": "Technical description of changes to existing behaviour.",
          "items": { "type": "string", "minLength": 1 }
        },
        "fixed": {
          "type": "array",
          "description": "Technical description of bug fixes.",
          "items": { "type": "string", "minLength": 1 }
        },
        "removed": {
          "type": "array",
          "description": "Technical description of removed features or behaviour.",
          "items": { "type": "string", "minLength": 1 }
        }
      }
    },
    "release": {
      "type": "object",
      "description": "A versioned release. Recommended property order: version, date, quote, issues, cves, highlights, audienceHighlights, added, changed, fixed, removed. JSON Schema cannot enforce ordering; generators must apply it explicitly.",
      "required": ["version", "date"],
      "unevaluatedProperties": false,
      "allOf": [{ "$ref": "#/$defs/changelogEntry" }],
      "properties": {
        "version": {
          "type": "string",
          "pattern": "^\\d+\\.\\d+\\.\\d+.*$",
          "description": "Semver string, including optional pre-release suffix (e.g. '1.0.0-beta.1')."
        },
        "date": {
          "type": "string",
          "pattern": "^\\d{4}-\\d{2}-\\d{2}$",
          "description": "Release date in ISO 8601 format (YYYY-MM-DD)."
        },
        "quote": {
          "type": "object",
          "description": "Optional, freely-written one-line release-note flavour text — editorial prose reflecting something notable about this release. This is NOT a served Quotinator quote from data/sources/ and is not subject to the project's 'never invent quotes' policy (that rule governs the quote dataset the API serves, not release-note prose); it is in the same category as 'highlights'. Not available on 'unreleased' (which has no version yet).",
          "additionalProperties": false,
          "required": ["text"],
          "properties": {
            "text": {
              "type": "string",
              "minLength": 1,
              "description": "The one-line flavour quote text."
            },
            "attribution": {
              "type": "string",
              "minLength": 1,
              "description": "Optional attribution for the quote — who said it, or where it came from."
            }
          }
        }
      }
    }
  }
}
