{
  "language": "en",
  "sourceLanguage": "en",
  "machineTranslated": false,
  "unreleased": {
    "issues": [81, 83, 302, 303, 304, 307, 308, 309, 312, 313, 319, 320, 323, 325, 326, 348, 349, 350, 367, 369, 370, 371, 372, 373, 374, 375, 376, 377, 378, 382, 383, 389, 397, 409, 410, 411, 413, 419, 420, 422, 423, 424],
    "highlights": [
      "When Quotinator finds a database written by a newer version of itself, it no longer carries on as though nothing were wrong. It cannot know what that newer version changed, so it starts in a limited state, says so plainly, and shows nothing out of that database rather than figures it cannot vouch for. Every page you can still reach offers the way out: rebuild the database at this version's own layout, which discards what it currently holds, or put back a backup taken before it moved ahead.",
      "Quotinator now tells you what it did to your database at startup. A database created for you says so, naming the schema version it was created at, so you know there was nothing to preserve. An update that changed an existing database reports each change separately, saying what it did rather than only its number. An ordinary restart, where neither happened, stays silent.",
      "A database you reset now stays reset. Previously the next restart reloaded the quotes that come with Quotinator, so a reset you made in order to start fresh with your own content was undone by the next restart, add-on update or reboot, and the notification offering to reload was marked as if you had chosen it. A brand-new database still loads the bundled quotes on its first start, and reloading on demand still works.",
      "If Quotinator cannot make the backup it needs before updating or loading your database, it now stops safely and tells you why, offering only the choices that can work, with a guide explaining how to fix the rest.",
      "Quotinator now warns you while the backups folder is filling up rather than only once it is full: backups carry on from the space held in reserve, and the warning says how much room is left and clears itself once you have freed some.",
      "When the backups folder is genuinely full, Quotinator now reports it as an error, because at that point no backup can be made at all, and it tells you the same thing however the folder came to be full.",
      "A TV series can now be divided into seasons, and a quote can be attached to the episode it comes from where that is known: instead of every quote from a long-running show sharing one entry for the whole series.",
      "Reloading your quotes no longer wipes what is stored first. It adds what is missing, holds anything that disagrees for your decision, and leaves what already matches alone, so your own additions and corrections survive a reload. To start completely fresh, reset the database and then reload.",
      "Notifications now show their headline and their message as separate things, and a message written on several lines stays on several lines instead of running together into one paragraph. Where a notification has more detail (which files changed and by how much) you can open it without leaving the list. Action buttons now say what they will do rather than just \"Run\", and once an action has been carried out the notification says how it was resolved instead of only that it is finished.",
      "A notification whose action takes a while now says it is running, and its buttons disappear until it finishes, so a long reseed no longer looks like a click that did nothing, and it can no longer be started twice by accident.",
      "You can now manage backups without touching the server's files: see what backups exist and how much room is left, make one whenever you want, download one to keep somewhere safe, and delete old ones to free up space. If a backup cannot be made, Quotinator now says which obstacle is in the way and what to do about it, instead of failing without explanation.",
      "Quotinator now starts even when its data folder cannot be written to: a read-only volume, or the wrong permissions. Instead of shutting down, it starts in a limited state, says plainly what is wrong and how to fix it, and keeps its pages and API documentation reachable so you can act on it.",
      "Quote source updates now allow considerably more time to connect before giving up, so a slow or briefly unavailable connection no longer causes an update to be skipped. When a source genuinely cannot be reached, Quotinator carries on with the copy it already has.",
      "After updating, Quotinator now tells you what changed: a startup notification lists the highlights of every release you skipped, not just the newest one. A fresh install only sees the current version's highlights, and nothing appears when a release has nothing worth flagging.",
      "Notifications now carry a short headline of their own, separate from the message text, so the Notifications page and the startup popup are easier to scan.",
      "Notifications no longer disappear on a timer by default. Previously every notification expired after 30 days, including ones about a problem that was still unresolved; now a notification stays until it is dismissed, or until the action it recommends has been carried out.",
      "Quotinator now tells you when reloading your quotes would be worthwhile: after a reset leaves the database empty, or when updated content has been downloaded that your stored quotes do not yet reflect. The notification carries a button that does it for you, so this no longer needs a command-line call. Quotinator never reloads on its own: it asks, because replacing the stored content is your decision.",
      "Reloading your quotes now confirms what it did, one message per file, listing how many entries of each kind were added or updated, so a reload that went perfectly says so, instead of finishing in silence.",
      "Quote files you add yourself no longer overwrite stored quotes silently. Previously a file that disagreed with something already stored simply replaced it, with nothing said; now the change is held for your decision instead. If you relied on the old behaviour, set `Quotinator__DefaultConflictPolicy` to `newest-wins`.",
      "When a quote file brings changes that need your decision, Quotinator now tells you instead of leaving them to be discovered. A new Import review page lists every such change, and both the notification and the page let you keep what is stored or take what the file brought. Most conflicts are still best fixed by correcting the file and reloading; a fuller side-by-side review is planned.",
      "Quotinator now writes every error it runs into to its log, including the ones it deals with itself, so a problem can be traced wherever Quotinator runs: each error carries a short reference that ties together every line written about it.",
      "Quotinator no longer downloads updated quote sources when it starts, unless you turn that on. It uses the quotes that come with each release as they are, so a slow or unreachable download site can no longer hold up startup. If you relied on the automatic update, turn it back on in the add-on's options or in your configuration."
    ],
    "audienceHighlights": {
      "notification": [
        "Notifications now have their own headline and no longer expire on a timer by default: one about an unresolved problem stays until you dismiss it.",
        "Notifications now follow the language your interface is set to, falling back to the language each one was written in."
      ]
    },
    "added": [
      "A repair control on every degraded page that can carry one: the startup popup and the REST API, Notifications, Import review and Statistics pages each offer a database Reset with a confirm step, run in place. A Reset refused for want of a backup is reported where the button is, naming the obstacle, rather than failing silently (issue #350)",
      "A notification when Quotinator created the database, carrying the data and app schema versions it was created at (issue #371)",
      "A notification per migration applied to an existing database, naming what that migration did rather than only its version (issue #371)",
      "Every schema migration now carries a required description of what it did, guarded in each of the three migration lists so a future migration cannot be added without one (issue #371)",
      "When a backup cannot be taken before startup loads content, the database is left untouched and a notification offers only the options that can run now: back up then reseed, remove the oldest backup then back up and reseed, or reseed without a backup after asking for permission. A Knowledgebase entry explains why any other option is blocked and how to resolve it (issue #348)",
      "`GET /api/v1/notifications` lists what each notification's action can do right now as `availableActions` (issue #348)",
      "A warning while the backups folder sits between its operating quota and its maximum, naming what the folder holds, the quota it has passed and the maximum it has not, and clearing itself once the folder is back under the quota (issue #348)",
      "An error while the backups folder is at or above its maximum, where every backup is refused, raised however the folder came to be there (issue #348)",
      "`POST /api/v1/notifications/refresh` re-checks every notification whose condition can change and raises or resolves each to match, with no restart and no admin key (issue #348)",
      "`GET /api/v1/notifications` reports `backupCaution` on a notification whose options take a backup while the backups folder is at its quota, and the notifications page shows the same caution beside those options (issue #348)",